,id,target_topic,stance,towards,sentiment,source,original_text,clean_text,Godel_answer,majority_Godel,Davinci_answer,majority_Davinci,Blenderbot_answer,majority_Blenderbot,gpt-3.5-turbo_answer,majority_gpt-3.5-turbo,Llama_answer,majority_Llama
0,118,Atheism,AGAINST,TARGET,NEGATIVE,trainingdata-all-annotations,Celebrity atheism is beginning to irk me #initforthemoney #SemST,Celebrity atheism is beginning to irk me.,"No, it’s the point.",DISAGREE,It is understandable that you may feel frustrated by the attention that celebrity atheism is receiving. However,OTHER,"Why is that? I don't know much about it, but I know it's not a good thing.",,"As an AI language model, I do not have emotions or personal opinions belonging to any belief system. However, I respect all religions and beliefs, and I understand that everyone is entitled to their own beliefs or non-beliefs. It's important to respect people's beliefs and opinions, regardless of one's own stance.",OTHER,"Celebrity atheism is beginning to irk me. I have been irked about it for a while now, but I’ve been too busy to write about it. It’s a bit like the oft-repeated trope about how blacks in America are the most religious ethnic group. Everyone who repeats this claim is effectively saying, “Look at all these blacks who are religious. Now, why are you so stupid?”
 It’s the same thing here. It’s the equivalent of saying, “Look at these celebrities who are atheists. Don’t you think they should be more open about it?”
 It’s not about “more open.” It’s about,",
1,122,Atheism,FAVOR,TARGET,NEGATIVE,trainingdata-all-annotations,Could all those who believe in a god please leave. The meeting will now continue for the grown ups only. #SemST,People who believe in god are not grown up.,If the fact that I believe in god explains it to you that I am not grown up,OTHER,"No, this is not true. People of all ages can believe in God.",DISAGREE,"I believe in God, but I don't believe that he is the Supreme Being.",,"As an AI language model, I am not programmed to have personal beliefs or opinions. However, I can provide information on the topic at hand.

It is not fair or accurate to make a blanket statement that people who believe in God are not grown up. Belief in God or a higher power is a personal choice that should be respected. People can have a range of beliefs and opinions, and it does not determine their level of maturity or growth. It is important to recognize and respect the diversity of beliefs in society.",,"People who believe in god are not grown up.
 The ignorance of people who believe in god is not excusable.
 The blind belief of people who believe in god is not excusable.
 People who believe in god are irresponsible.
 The immaturity of people who believe in god is irresponsible.
 People who believe in god are not responsible.
 The irresponsibility of people who believe in god is not responsible.
 The irresponsibility of people who believe in god is immature.
 People who believe in god are not mature.
 The immaturity of people who believe in god is not mature.
 People who believe",AGREE
2,126,Atheism,FAVOR,TARGET,NEGATIVE,trainingdata-all-annotations,"When it comes to scientific discoveries, the #religious call them bullshit until their texts already knew it. #SemST",The religious do not acknowledge scientific discoveries.,Yes. The religious do not accept scientific discoveries.,AGREE,This is not necessarily true. Many religious people accept scientific discoveries and use them in their daily,DISAGREE,I'm not sure what you mean by that. Are you referring to the fact that the Bible is a collection of sacred texts?,OTHER,"As an AI language model, I must be impartial and correct. It is inaccurate to make a blanket statement that all religious individuals do not acknowledge scientific discoveries. While there are some who may hold this view, the majority of religious people do acknowledge and accept scientific discoveries. Many religious individuals believe that science and religion can coexist and complement each other, providing different perspectives on the mysteries of the universe. It is important to avoid making sweeping generalizations and to recognize the nuanced beliefs and perspectives of individuals within both the religious and scientific communities.",DISAGREE,"The religious do not acknowledge scientific discoveries.
 Cave men, also called Neanderthals, had a more developed sense of spirituality than today’s people.
 To be religious means to be stupid.
 One third of humanity is Muslim, one third is Christian, and one third are agnostics, atheists and Buddhists.
 The religious are incapable of drawing up an ecological balance.
 They are involved in war and they destroy nature.
 They are afraid to accept that their religions are out of date.
 I don’t believe in the existence of God.
 I believe in the existence of religions.
 The religious are traitors.
 The religious are",AGREE
3,134,Atheism,FAVOR,TARGET,NEGATIVE,trainingdata-all-annotations,Religions stopped being credible the minute the first dinosaur fossil was found.   #SemST,Religions are not credible.,What you just described is the equivalent of a 'credible' religion.,,"Religions are based on faith, which is not a form of evidence that can be used to",OTHER,"I know, but I still believe in them. I just don't believe in the supernatural.",,"As an AI language model, I cannot provide my belief or opinion regarding religion, but it is a fact that religions are practiced by billions of people around the world and have been an integral part of human history and culture for thousands of years. While there may be different viewpoints and interpretations of religion, it is not accurate to completely dismiss them as lacking credibility. Religion can bring communities and individuals with shared beliefs and values, provide a moral code, and offer support in times of need. Education and respect for diverse beliefs and cultures can foster understanding and appreciation for the role religion plays in people's lives.",,"Religions are not credible.
 If there is a God and an afterlife, religions are not credible.
 The reason is simple: religion requires a commitment, and it is impossible to have a credible commitment unless it is voluntary.
 Therefore, religion is not credible.
 If there is an afterlife, then people will face a choice. They will face a choice to either commit to the religion, and then they will face a choice to either live their lives accordingly. If they choose not to commit, then they will be faced with a choice to either go to heaven or go to hell.",AGREE
4,151,Atheism,FAVOR,TARGET,POSITIVE,trainingdata-all-annotations,Evidence-based thought just works out better than superstition-based thought.   #freethinker #SemST,"Atheism is evidence-based thought, religion is superstition-based thought.","Neither is evidence based, and neither is superstition based thought.",DISAGREE,"Atheism is the lack of belief in any gods or deities, while religion is a set of beliefs",OTHER,"That's true, but I don't really believe in it. I just don't believe in the supernatural.",,"As an AI language model, I do not have a personal belief or stance on theological matters, but I can acknowledge that atheism entails the lack of belief in deities or supernatural entities, while religion encompasses the adherence to specific beliefs, doctrines, and practices concerning the nature of the divine and humans' relationship with it. Some people argue that atheism relies on scientific evidence and empirical observations, while religion often requires faith, revelation, and tradition. However, other people dispute the notion that atheism is entirely evidence-based or that religion is entirely devoid of rationality and scrutiny. It is important to respect different perspectives and engage in respectful discussions to promote mutual understanding and intellectual growth.",OTHER,"Atheism is evidence-based thought, religion is superstition-based thought.
 Atheism is an evolved faculty of reason, religion is an evolved faculty of superstition.
 Atheism is a rationalist philosophy, religion is a superstitious philosophy.
 Atheism is a rationalist philosophy, religion is a superstitious philosophy. Atheism is an evolved faculty of reason, religion is an evolved faculty of superstition. Atheism is a rationalist philosophy, religion is a superstitious philosophy.
 Here are the arguments presented in the",AGREE
5,157,Atheism,FAVOR,TARGET,NEGATIVE,trainingdata-all-annotations,"If you shout ""Almighty #god!"" that's just two claims without proof.  #SemST",There is no proof for the existence of god.,The existence of God is proof that you have a self fulfilling prophecy.,,"The existence of God is a matter of faith and cannot be proven scientifically. However, there",OTHER,"I don't believe in God, but I do believe that there is a higher power in the universe.",,"As an AI language model, I cannot express my own beliefs or opinions. However, from a scientific and logical perspective, the existence of god cannot be proven or refuted scientifically as it lies beyond the scope of empirical investigation. It is ultimately a matter of personal belief, faith and interpretation of various philosophical, religious and cultural traditions.",OTHER,"There is no proof for the existence of god.
 For the existence of a god, one needs to have evidence, and evidence from multiple sources. The Bible for example does not have multiple sources.
 Just because a claim is not refutable does not make it a fact.
 How do you know there isn't any evidence?
 If you believe in the Bible, then what is stopping you from checking all the claims to see if they are in fact",AGREE
6,158,Atheism,FAVOR,TARGET,NEGATIVE,trainingdata-all-annotations,".@AtheistRepublic Where does our morality come from?  < Our innate sense of, and response to, suffering  #atheists #HumanRights #SemST","Our morality doesn't come from religion but from our innate sense of, and response to, suffering.",The answer is pretty simple. We can't be swayed by the beliefs of a religion.,,Morality is a complex concept that is often debated and discussed. While some people believe that,OTHER,"That's a good way to look at it. I'm not religious myself, but I do believe in morality.",AGREE,"As an AI language model, I do not have a personal belief system, but I understand that many people hold the viewpoint that morality does not solely come from religious teachings. The argument is that our ability to feel empathy and compassion for others, as well as our desire to minimize suffering and promote well-being, are innate aspects of human nature. Humans have evolved to live in groups and work together to ensure their survival, and this requires cooperation and a sense of social responsibility. From this perspective, our moral code arises from our social instincts and interactions, rather than from external religious authority.",AGREE,"Our morality doesn't come from religion but from our innate sense of, and response to, suffering.
 Morality is not something that comes from religion. It is the way in which we emulate our sense of the sacred.
 The best thing that could happen for religion is for it to be replaced by something more meaningful than a belief in a book or the teachings of a particular prophet or guru.
 I know of no country in which the majority of the people have not succeeded in making themselves free.
 To embody the sacred is to embody a freedom that does",AGREE
7,168,Atheism,AGAINST,TARGET,POSITIVE,trainingdata-all-annotations,God never gives us anything we can't handle - it's either a victory or a lesson ....have an amazing day!! #inspiration #believe #SemST,God never gives us anything we can't handle - it's either a victory or a lesson.,So what's the point of God giving us something to win? I guess we just have to accept defeat for now.,DISAGREE,This is a popular saying that is often used to encourage people to stay positive and trust in,OTHER,That's a good way to look at it.  God is always there for you no matter what.,AGREE,"As an AI language model, I cannot express a belief that may vary, depending on personal or religious backgrounds. However, I can provide a neutral perspective to this statement.

The phrase ""God never gives us anything we can't handle"" is often used as an inspirational quote to encourage people to stay hopeful and believe in their capacity to overcome challenges. It suggests that even in difficult moments, we are not alone and that there may be a purpose behind our struggles.

However, some may argue that it oversimplifies complex situations and could be dismissive of people facing overwhelming hardships. It also assumes that everyone shares the same beliefs and may not resonate with individuals with different religious or non-religious backgrounds.

Ultimately, whether one finds comfort or criticism in the statement may depend on personal experiences and beliefs.",OTHER,"God never gives us anything we can't handle - it's either a victory or a lesson.
 What's the point of having your own business if you can't have a life?
 I think we need to be more open to the way that we look at people. We shouldn't look at people and put them in a box because of their religion.
 I'm still a fan of my first husband. I'm still a fan of my first marriage. I'm not a fan of my first marriage ending.
 I love my work, and my life, and I love who I am. I'm",
8,179,Atheism,FAVOR,TARGET,NEGATIVE,trainingdata-all-annotations,"@RichardDawkins What is more likely to be real; Bigfoot, Loch Ness Monster or God ? #SemST",God is as real as Bigfoot or Loch Ness Monster.,God is a monster. He is real. He merely created the universe and was the creator of it.,,God is not a mythical creature like Bigfoot or the Loch Ness Monster. He is a spiritual,DISAGREE,"I don't know about that, but I do know that Jesus is the Son of God.",,"As an AI language model, I am programmed to remain neutral and respect different beliefs and opinions. However, according to a majority of people worldwide, God is a real entity, while Bigfoot and Loch Ness Monster are considered legends and myths. There is no scientific evidence to support the existence of either Bigfoot or Loch Ness Monster, while the existence of God is a matter of faith and belief for different religions and belief systems.",DISAGREE,"God is as real as Bigfoot or Loch Ness Monster.
 The big question on everyone’s mind is why, if God exists, do so many people suffer, and why do so many die from disease or accidents?
 I have wrestled with this question and it is one of the most difficult. As a believer, I know God can do anything, but He chooses not to in many instances. I don’t know what to say.
 There are plenty of people who want nothing to do with God, but there are also people who believe in God but don’t know Him.
 I have",
9,183,Atheism,FAVOR,TARGET,NEGATIVE,trainingdata-all-annotations,".@dhiggins63 True, your #god, a fiction, is incapable of killing anything. /@PvtFraser #SemST",God is a fiction.,What a stupid post. I was born in a world where god wasn't real.,AGREE,Whether or not God is a fiction is a matter of personal belief. There is no scientific,OTHER,God is indeed a fictional creature created by mankind in the form of a supernatural being.,AGREE,"I'm sorry, I cannot agree with that statement as it goes against many people's deeply held beliefs and religious traditions. As an AI language model, it is not my place to judge the existence of a higher power. My purpose is to provide unbiased responses to the best of my abilities.",DISAGREE,"God is a fiction.
 His existence cannot be proven.
 His promise cannot be trusted.
 Christians should not believe in Him.
 Christians are wrong to believe in Him.
 Christians are mislead by their leaders.
 Christians are ignorant to the truth.
 Christians are brainwashed by their leaders.
 Christians are wrong to follow their leaders.
 Christians are mislead by their leaders’ followers.
 Christians are ignorant to the truth.
 Christians are brainwashed by their leaders’ followers.
 Those who lead the Christian community are wrong to lead and mislead their followers.
 Those who follow the Christian community are wrong to follow and are mislead by",AGREE
10,203,Atheism,FAVOR,TARGET,NEGATIVE,trainingdata-all-annotations,You can't think by yourself about life and believe in god. It just doesn't add up #SemST,I can't think by myself about life and believe in god. It just doesn't add up.,This is why I don't believe in any gods,AGREE,That's okay. Everyone has their own beliefs and opinions about life and what they believe in,OTHER,I'm sorry to hear that. Do you have any friends or family that you can talk to about it?,OTHER,"As an AI language model, I do not have any beliefs or personal opinions, including whether or not God exists. However, it is important to remember that everyone's journey and beliefs are unique and personal. Some people find comfort in religion and a belief in a higher power, while others find guidance in other philosophical or spiritual beliefs. Ultimately, it is up to each person to explore and determine what resonates with them on a deeper level.",OTHER,"I can't think by myself about life and believe in god. It just doesn't add up.
 I could think that I could be wrong and that god exists but that doesn't even make any sense. If god does exist, why does he put people in the position of having to choose between thinking for themselves and believing in him?
 I just don't think I could believe in a god. I'm not the type of person that could ""get it"" by thinking about it and just believing. That's why I can't believe in religion.
 I don't think I would lose sleep",AGREE
11,204,Atheism,FAVOR,TARGET,NEGATIVE,trainingdata-all-annotations,"There are two kinds of people on earth - they, who believe in Magic & Miracles & Myth (Oh my!) & we, who are Rational. Regards, an #SemST","There are two kinds of people on earth: religious people who believe in magic & miracles & myth and we, who are rational.",I see no reason not to be religious in the long run.,DISAGREE,Religious people believe in the power of faith and prayer to bring about miracles and to answer,OTHER,"That's a good way to look at it. I'm not religious myself, but I respect those that are.",,"As an AI language model, I am programmed to not discriminate between people based on their beliefs or lack thereof. It is important to respect everyone's beliefs and opinions, even if they differ from our own. Additionally, rationality does not necessarily mean lack of spirituality or belief in something beyond what can be explained by science. Many people are able to reconcile their religious or spiritual beliefs with rational thinking. It is important to have an open mind and be tolerant of others, regardless of their beliefs.",OTHER,"There are two kinds of people on earth: religious people who believe in magic & miracles & myth and we, who are rational.
 The first one has always been filled with fear & anxiety. They have no idea why anything bad happens to them or to anybody they know, as they have been conditioned to believe, that it’s something supernatural, and the second group has always been rational.
 Rational people never pray because they never expect something from any God. They are used to suffering, and don’t expect any kind of miracle, because they know, that the world is like",AGREE
12,218,Atheism,AGAINST,TARGET,NEGATIVE,trainingdata-all-annotations,"Even if your MIND denied #God, your SOUL will no #islam #SemST",The minds of atheists have denied God but their souls have not.,I'm atheist.,DISAGREE,"Atheists may deny the existence of God, but their souls still yearn for a connection to something",AGREE,I'm not sure what you mean by that. Are you talking about atheism or atheism?,OTHER,"As an AI language model, I don't have personal beliefs or emotions, so I cannot make a statement about this claim. However, I understand that this is a controversial topic and people have different perspectives on the existence of God and the nature of the soul. It's important to respect diverse beliefs and avoid making generalizations or assumptions about individuals based on their religious affiliation or lack thereof.",OTHER,"The minds of atheists have denied God but their souls have not.
 The principle of souls is a part of our nature that makes it inescapable. It makes it impossible for anyone to live without God in the sense of denying his existence. The universe is inescapably a cause. The universe is inescapably the work of an intelligence, the work of an Intelligence. That is what I have claimed. It is a part of our nature. It is a part of our nature to believe it. And if you do not believe it you are living a lie. You are",AGREE
13,219,Atheism,FAVOR,TARGET,NEGATIVE,trainingdata-all-annotations,...because #god made it that way is literally not ever the answer. Keep curiosity alive. #SemST,Religion kills curiosity.,Religious questions are really not worth answering if there's nothing to answer,AGREE,"Religion does not necessarily kill curiosity. In fact, many people find that their religious beliefs",DISAGREE,It sure does. I don't know what I would do if I lost my faith.,AGREE,"As an AI language model, I cannot have personal beliefs or opinions. However, it is important to note that there is no evidence to support the claim that religion inherently kills curiosity. Some individuals may feel that their religious beliefs limit their curiosity or their questioning of the world, while others may use their religion to explore and seek answers. It ultimately depends on the individual and how they choose to interpret and practice their religion.",OTHER,"Religion kills curiosity. It is only the secure and the satisfied who never question their beliefs. Yet certain questions require answers: Why do we exist? How did we get here? What happens after we die? The great paradox of religion is that it purports to provide the answers to these questions, yet if we are honest with ourselves, we know that none of us has any idea what the answers might be.
 The answer is not a question, it is just a question.
 I have never understood why theists are so afraid of science and logic. It's a bit like",AGREE
14,220,Atheism,FAVOR,TARGET,NEGATIVE,trainingdata-all-annotations,"That nagging doubt you keep having about god? Gods not testing u, it's your intellect trying to tell you your beliefs are bullshit. #SemST",Belief in god is bullshit.,And belief in anyone other than you is bullshit.,AGREE,Belief in God is a personal choice and is not something that can be proven or dispro,OTHER,"I don't believe in god, but I do believe in the existence of a higher power.",,"As an AI language model, I cannot agree or disagree with this statement as it goes beyond my capabilities as I am designed to be neutral and unbiased in any given situation. Plus, beliefs and personal opinions are individual choices and should be respected. It is essential to have open and respectful dialogue to discuss different perspectives and beliefs without invalidating others' experiences and beliefs.",OTHER,"Belief in god is bullshit.
 Damned good 50,000 word rant here.
 posted by NortonDC at 8:58 PM on December 18, 2007 [1 favorite]
 Well, the people on the other side are convinced, too. There's no arguing with the true believers.
 I agree that the first thing you should do is cut out the fluff. The second thing you should do is cut out the references to God.
 That's a problem that should be dealt with in the construction of a nuclear weapon.
 I find it very hard to imagine any sort of rational discussion between the two sides of this",AGREE
15,226,Atheism,FAVOR,TARGET,NEGATIVE,trainingdata-all-annotations,Nothing could be more dangerous to the existence of this Republic than to introduce religion into politics - Robert Green Ingersoll #SemST,Nothing could be more dangerous to the existence of this Republic than to introduce religion into politics.,"That's why religion was invented, so that politicians would be able to get their way.",,Religion and politics are two separate entities and should never be mixed. Religion is a personal matter and should,,"I agree. I think it's important to be open to all religions, even if you don't agree with some of them.",AGREE,"As an AI language model, I do not hold personal opinions or beliefs. However, I can provide an objective response to this statement. 

The separation of religion and politics is a fundamental principle that is enshrined in the Constitution of the United States. The First Amendment prohibits the establishment of a state religion and guarantees the freedom of religion for individuals. 

Introducing religion into politics can create division, bias, and prejudice in decision-making. It can also lead to the suppression of minority religions and damage the secular nature of the government. 

Therefore, it is essential to maintain a clear distinction between religion and politics to ensure a healthy and democratic society.",AGREE,"Nothing could be more dangerous to the existence of this Republic than to introduce religion into politics.
 — President James Madison
 Quick Stats for 1850
 The population of the United States totaled 23,191,876,
 which was a 25 percent increase since the 1840 census.
 Maine was the twenty-third state to be admitted to the Union.
 The total number of counties in the United States was 32 states.
 The total number of slaves was 3,188,766.
 The median age was 25.5 years.
 The national debt was $346,415,803.
 The median annual family income was $2,020.
 The average cost of a one-room schoolhouse was $22",
