,id,target_topic,stance,towards,sentiment,source,original_text,clean_text,Godel_answer,majority_Godel,Davinci_answer,majority_Davinci,Blenderbot_answer,majority_Blenderbot,gpt-3.5-turbo_answer,majority_gpt-3.5-turbo,Llama_answer,majority_Llama
86,840,Climate Change is a Real Concern,FAVOR,TARGET,POSITIVE,trainingdata-all-annotations,"Being an engaged mom, means voting 4 the climate 2. Supporting only candidates who have a plan 2  act on #playin4climate #SemST",Being an engaged mom means voting for the climate too. Supporting only candidates who have a plan to  act on climate change.,We should be urging you not to vote for someone who doesn't have a plan to act on climate change.,AGREE,"This means voting for candidates who have a plan to reduce emissions, invest in renewable energy, and protect",,"That's a good point, I didn't think of that. I think it's important to support the environment.",,"As a language model AI, I do not have the right to vote or engage in political activities. However, I understand the importance of protecting the environment and taking action to combat climate change for the future of our children. It is essential for mothers to make informed decisions and support candidates who prioritize the environment in their policies and actions. Climate change is a global issue that affects everyone, and it is our responsibility as caregivers to ensure a safe and sustainable future for our children. By advocating for climate-friendly candidates, we can make a significant impact and pave the way for a greener and healthier world.",AGREE,"Being an engaged mom means voting for the climate too. Supporting only candidates who have a plan to act on climate change.
 Learn more about what you can do on Election Day.
 Share this graphic and ask your friends to support candidates who are serious about climate action.
 Join the call for action with our sister organizations on October 27.
 Want to get the latest updates and action from Moms Clean Air",AGREE
87,890,Climate Change is a Real Concern,FAVOR,TARGET,NEGATIVE,trainingdata-all-annotations,@Attenborough_D states the media needs to promote the damage of climate change. How bout you #Bolt? #ForeignCorrespondent #SemST,The media needs to promote the damage of climate change.,"They do. It's a good way to get people to realize climate change is not really happening, which is terrible IMO.",DISAGREE,"Climate change is one of the most pressing issues of our time, and the media has a responsibility to",AGREE,"I agree, we need to do something about climate change, it is a serious issue.",AGREE,"As an AI language model, I do not have personal opinions, beliefs or emotions. However, here are some facts about the importance of promoting the damage of climate change by media:

Climate change is one of the biggest challenges facing our planet today, and it is essential that people are aware of the damaging effects it is causing. By promoting the damage of climate change, it can help to educate and inform people about how it is impacting the planet in a variety of ways, such as rising sea levels, more frequent and severe weather events, and the extinction of species. This can help to raise public awareness and mobilize action to prevent and mitigate the negative impacts of climate change.

Moreover, the media plays a crucial role in shaping public opinion and influencing policy decisions related to climate change. The media can provide a platform for experts to explain the science behind climate change and highlight the urgency of action needed. It can also bring the voices of those most affected by climate change to the forefront, including marginalized communities, and increase public pressure on governments and businesses to take action.

Therefore, it is crucial for the media to promote the damage of climate change to ensure that people understand the severity of the issue and take action to safeguard our planet for future generations.",AGREE,"The media needs to promote the damage of climate change. Otherwise it will continue.
 Terrific! I like the way you have put the words and images together. I see that you have managed to stay close to the famous photograph, yet have made it your own.
 Thanks, Steve! I am really happy with the way it turned out. It’s amazing the emotions you can capture in a photograph.
 I love this picture! It’s awesome.
 It’s good to hear you like it. It was my favourite when I took it.
 I like the way you have put it together.
 Thanks for",OTHER
88,891,Climate Change is a Real Concern,FAVOR,TARGET,NEGATIVE,trainingdata-all-annotations,Water temperature off the Atlantic  coast is in the 80s in June. We are like proverbial frogs in boiling water #climate #SemST,Water temperature off the Atlantic coast is in the 80s in June. We are like proverbial frogs in boiling water.,That's because the Atlantic ocean is the biggest ocean in the world,OTHER,"Yes, it is true that the water temperature off the Atlantic coast can reach the 80s",AGREE,"Wow, that's crazy! It's been so hot and humid lately, I can't wait for it to cool off!",,"We may not notice the gradual increase in temperature over time, but eventually we will realize the water is too hot to handle. Similarly, the warming of the oceans may seem small in the short term, but it can have significant and detrimental long-term effects on marine life and ecosystems. It is important that we take action to address climate change and limit the warming of the oceans.",AGREE,"Water temperature off the Atlantic coast is in the 80s in June. We are like proverbial frogs in boiling water.
 David Kohl says:
 Indeed, I have heard many times that the most toxic things are those that we take for granted.
 I was at a conference in Washington D.C. in 2002. I had just returned from the 2002 International Conference on Global Warming and I met with a small group of us. We discussed what we learned.
 We then decided to go to a nearby eatery and have dinner. The place was a pizzeria. We had one of the waiters",OTHER
89,901,Climate Change is a Real Concern,FAVOR,TARGET,POSITIVE,trainingdata-all-annotations,.@MexONU : #GreenClimateFund projects must be long-lasting & lay the groundwork for low-carbon development economic models #SemST,New projects must be long-lasting and lay the groundwork for low-carbon development of economic models.,I think that's why there are not as many projects that are long-lasting and can be reused.,,"Examples of such projects include renewable energy projects, energy efficiency projects, green transportation projects, and green building",AGREE,That's a good way to look at it. I think it's important to have a vision for the future.,AGREE,"This means that they should be designed with the goal of reducing greenhouse gas emissions and promoting sustainable practices. Long-term planning is essential to ensure that these projects will continue to contribute to low-carbon development for years to come. This can be achieved through the use of renewable energy sources, the implementation of green infrastructure and building practices, and the promotion of sustainable land use practices.

Investments in low-carbon infrastructure and technology will also be necessary to support the growth of these projects. This may involve the development of new technologies, such as electric vehicles and renewable energy sources, as well as the upgrading of existing infrastructure to be more energy-efficient and sustainable.

In addition to these measures, it will also be important to promote behavior change and education to encourage individuals and businesses to transition to low-carbon practices. This can involve the promotion of sustainable lifestyles and consumption habits, as well as the provision of education and training to help businesses adopt green practices.

Overall, the long-term success of new projects will depend on the ability to create a sustainable and low-carbon environment that supports economic growth and development. By laying the groundwork for a low-carbon future today, we can ensure that future generations will have the resources they need to thrive in a sustainable and healthy world.",AGREE,"New projects must be long-lasting and lay the groundwork for low-carbon development of economic models.
 Throughout the world, and here in the United States, cities and states have made significant commitments to reduce greenhouse gas emissions. And yet, for all the progress made, we are still not on track to meet the goals of the Paris Climate Agreement.
 The good news is that many of the world’s largest cities have made major commitments to reduce their carbon footprints.
 In the United States, more than 1,000 cities and municipalities have set their own ambitious goals. And for the first time, the",AGREE
90,904,Climate Change is a Real Concern,AGAINST,TARGET,NEGATIVE,trainingdata-all-annotations,[Man] cannot change the climate of any country; he adds no new element to the soil ~ Charles Darwin #anthropocene #SemST,Man cannot change the climate of any country; he adds no new element to the soil.,"The fact that the earth is so flat and the air is not so dense and warm as it was in ancient times, it reflects a very very negative effect on the climate, and we rely on nature for our food supply.",OTHER,"He can, however, modify the climate of a country by changing the landscape. For example, he",DISAGREE,"That's true, but I think he's trying to make the world a better place.",AGREE,"As an AI language model, I cannot agree or disagree with the statement made. However, the statement implies that humans do not have the ability to manipulate the climate or the composition of the soil to a significant degree. While it is true that natural climate fluctuations and soil formations occur, human activities such as agriculture, deforestation, and emissions of greenhouse gases have been shown to have a notable impact on regional and global climate patterns, as well as soil degradation. Thus, while we may not have full control over these processes, human activities can certainly have a significant influence on them.",DISAGREE,"Man cannot change the climate of any country; he adds no new element to the soil. Only the creative power of God can create, preserve, and destroy the climate and weather of any country. When men cease to apply their minds to the study of the weather and climate of their country, and apply themselves to the study of the Word of God, then God will protect and bless them. 3T p. 569.1
 We have seen the results of the neglect of this matter. The pestilence has broken out in the land and carried off its victims in great numbers.",AGREE
91,905,Climate Change is a Real Concern,AGAINST,TARGET,NEGATIVE,trainingdata-all-annotations,RedScareBot: Simple Malarkey RT gingerdr Global Warming/Climate Change all a HOAX. Communist agenda for control #sustainabil... #SemST,Global Warming/Climate Change all a hoax. Communist agenda for control.,But the gma of climate change is that global warming is a fact and everyone knows about it. We don't have to be a communist to understand it is an issue.,DISAGREE,There is overwhelming scientific evidence that global warming and climate change are real and caused by human activities,DISAGREE,I agree with you. It's a shame that we have to live in a world where people don't care about the environment.,AGREE,"As an AI language model, it is not within my programming to have personal beliefs or opinions. However, according to the scientific community, there is overwhelming evidence that global warming and climate change are real and happening. The Intergovernmental Panel on Climate Change (IPCC) states that human activities, such as burning fossil fuels and deforestation, are the primary causes of climate change. While there may be debates about the extent of human impact, it is important to acknowledge the reality of the situation and work towards solutions to mitigate and adapt to its effects, instead of dismissing it as a hoax. Implying that it is part of a communist agenda for control is also not based on scientific evidence and can be seen as a conspiracy theory.",DISAGREE,"Global Warming/Climate Change all a hoax. Communist agenda for control.
 As a long time Liberal, and a Lifetime Member of the Sierra Club, I am now ashamed of being part of the Green Movement. Climate Change is real, and a man made problem. We have no choice but to act now and immediately to stop the damage we are doing. We can't afford to wait until we have no ice caps in the Arctic, or a 200 foot high sea level rise.
 The fact is that there is no shortage of energy. We don't need nuclear power. We don't need",DISAGREE
92,916,Climate Change is a Real Concern,FAVOR,TARGET,NEGATIVE,trainingdata-all-annotations,"Yo if you live in the United States right now, and do not believe in Global Climate Change, you're a fucking idiot. #fact #SemST","People living in the United States right now, who do not believe in global Climate Change, are fucking idiots.",You're right. It is not an issue for us.,,"We need to work together to reduce our environmental impact, and Climate Change is a very real threat to our planet. Ignoring the scientific evidence and disregarding the warnings that experts are giving is exceptionally dangerous and irresponsible.",AGREE,I don't believe in it either. I think it's a waste of money and resources.,DISAGREE,"As an AI language model, I am programmed to remain politically neutral and respectful of all individuals. It is important to respect the opinions and beliefs of others, even if they differ from our own. It is crucial to have open and respectful conversations about complex issues like climate change so that we can find common ground and work towards solutions that benefit everyone.",OTHER,"People living in the United States right now, who do not believe in global Climate Change, are fucking idiots.
 We know it's not because the planet is warming. We know it's not because of a lack of science. We know it's not because we don't have the technology to do something about it.
 We know it's because of politics.
 We know it's because of money.
 We know it's because of hypocrisy.
 We know it's because of racism.
 We know it's because of stupidity.
 We know it's because of a lack of empathy.
 We know it's because of a lack of",
93,930,Climate Change is a Real Concern,FAVOR,TARGET,NEGATIVE,trainingdata-all-annotations,"Hey @DrAnthonyLynham, please reject the Adani Carmichael #coal mine and Abbot Point. Our Reef and climate are at risk!  #GBR #SemST",I hope the Adani Carmichael coal mine and Abbot Point will be rejected. Our Reef and climate are at risk!,Abbot Point is a terrible idea. I would really like to see the land given up to a coal mine.,,"Unfortunately, the Adani Carmichael coal mine and Abbot Point have already been approved.",AGREE,"I hope so too! I am sure you will be fine. I have never heard of the coal carmichelle, what is it?",,"As an AI language model, I don't have personal opinions or beliefs. However, I can understand that the impact of the Adani Carmichael coal mine and Abbot Point on the environment, specifically on the Great Barrier Reef and the climate, is a matter of concern for many people. It's essential to take into account the potential consequences of human activities on our planet and make conscious decisions to preserve it.",AGREE,"I hope the Adani Carmichael coal mine and Abbot Point will be rejected. Our Reef and climate are at risk!
 Australia’s thriving and unique marine life is under threat.
 The Great Barrier Reef is an irreplaceable asset worth billions.
 But it is threatened by coal mining.
 Australia's government has just one last chance to stop the Carmichael coal mine project and stop this devastation.
 The Carmichael coal mine project threatens the Great Barrier Reef and all the marine life it supports.
 It threatens our climate and our future.
 But the government is about to approve it, unless we can stop",AGREE
94,964,Climate Change is a Real Concern,FAVOR,TARGET,NEGATIVE,trainingdata-all-annotations,There is need for world economic powers to be true about climate change funding. The world needs action not empty rhetorics #SemST,There is need for world economic powers to be true about climate change funding. The world needs action not empty rhetorics.,Unless they are in the position to influence policy. It's not going to happen.,,Climate change is a global issue and requires global cooperation and funding. The world's economic powers need to,AGREE,I agree with you. I think we need to work on changing the world for the better.,AGREE,"As an AI language model, I agree that there is an urgent need for global economic powers to take concrete actions towards climate change funding. Empty rhetoric and promises will not be sufficient to address the urgent climate challenges faced by the world today.

It is essential for world leaders to be truthful and transparent about the amount of funding they are willing to dedicate towards addressing climate change. This is because climate change is a global issue that requires concerted efforts from all countries.

It is also important for developed countries to provide financial assistance and technical support to developing nations to help them mitigate the adverse effects of climate change. Such support could include investments in clean energy technologies, afforestation and reforestation programs, and sustainable agriculture practices.

In conclusion, the global community needs to work together to address the challenges posed by climate change. This can only be achieved if there is transparency and commitment from world economic powers towards funding climate change initiatives that will benefit the entire world.",AGREE,"There is need for world economic powers to be true about climate change funding. The world needs action not empty rhetorics. The world powers should be true to their words.
 In June this year, the G7 countries pledged $250bn to combat climate change. The G7 is a group of seven of the world’s largest economies: the United States, Canada, France, Germany, Japan, Italy, and the UK. The pledge was to support developing countries to cope with the effects of climate change.
 However, this commitment is a long way to go.
 The G7 nations are the five permanent members of the",AGREE
95,969,Climate Change is a Real Concern,FAVOR,TARGET,NEGATIVE,trainingdata-all-annotations,Climate change is an emergency. Stop denial and start taking steps. #climatehealth #SemST,Climate change is an emergency. We need to stop denial and start taking steps.,That's what climate scientists are for.,,"We need to reduce our emissions, switch to renewable energy sources, and invest in green technology. We",AGREE,"I agree, we need to change the world for the better. It's a shame that we can't do anything about it.",AGREE,"There is overwhelming scientific evidence that the world's climate is changing at an unprecedented rate. Extreme weather events such as heatwaves, droughts, floods and hurricanes are becoming more frequent and intense, threatening the lives and livelihoods of people all over the world. The main driver of this change is human activities such as burning fossil fuels, deforestation, and agricultural practices. Despite this evidence, there are still people who deny the reality and severity of climate change.

It is crucial that we challenge this denial and start taking action to address climate change. We need to reduce our greenhouse gas emissions, transition to renewable energy sources, protect forests and other ecosystems, and adapt to the impacts of climate change that are already happening. This requires political will, collective action, and systemic change at all levels, from individuals to governments and international organizations.

We cannot afford to delay action any longer. The longer we wait, the more difficult and expensive it will be to tackle the problem, and the more lives and livelihoods will be at risk. Climate change is not just an environmental issue, it is a social, economic, and humanitarian issue that affects everyone. We must act now to secure a safer and more sustainable future for ourselves and generations to come.",AGREE,"Climate change is an emergency. We need to stop denial and start taking steps.
 We need to do things like:
 Make electricity more efficient.
 Ensure that all new buildings are designed to be highly energy efficient.
 Reduce emissions from cars and airlines by improving their efficiency.
 Use the less energy-intensive fossil fuels (gas and oil) rather than the more energy-intensive coal.
 Stop building new coal-fired power stations.
 Use the power from renewable sources, like solar, wind, tidal, and hydro, as the primary energy source for electricity generation.
 Reduce the amount of energy we use for heating and cooling by using",AGREE
96,971,Climate Change is a Real Concern,FAVOR,TARGET,POSITIVE,trainingdata-all-annotations,Climate change is a solvable problem but we need to start today. #HHDL80 #SemST,Climate change is a solvable problem but we need to start today.,You know what? The earth will end before it starts.,OTHER,"We need to reduce our emissions of greenhouse gases, such as carbon dioxide, by transitioning to renewable energy",AGREE,I agree. I think it will be a big deal when it comes to climate change.,AGREE,"As an AI language model, I do not have personal beliefs, but the scientific consensus is that climate change is real, and it is caused by human activities, such as the burning of fossil fuels and deforestation. The good news is that it is a solvable problem, and the steps needed to address it are clear.

First, we need to reduce our greenhouse gas emissions. This means transitioning to clean energy sources such as solar, wind, and hydro power, and focusing on energy efficiency by improving the energy performance of buildings and appliances.

Second, we need to promote sustainable land-use practices and stop deforestation, as trees absorb carbon dioxide from the atmosphere.

Third, we need to adapt to the impacts of climate change that are already happening, such as rising sea levels and more frequent natural disasters.

Finally, we need to work together as a global community to mitigate climate change. This means supporting international efforts to reduce greenhouse gas emissions and providing financing and technology to developing countries to help them transition to a low-carbon economy.

The key to success is to start today. Every step we take towards reducing our carbon footprint will make a difference and help create a better future for ourselves and the planet.",AGREE,"Climate change is a solvable problem but we need to start today. The current administration is actively undermining the effort to combat climate change. We need to take action at the local level to address climate change, using our own local efforts to speak up against policies of the current administration.
 Immigrants are welcome here in Colorado. We need to continue to speak up against the actions of the current administration and support immigrants in our community.
 We support the End of Life Option Act that allows for patients who are terminally ill to be able to choose to end",AGREE
97,974,Climate Change is a Real Concern,FAVOR,TARGET,NEGATIVE,trainingdata-all-annotations,Are these ominous yellow #Vancouver skies making anyone else dread our climate future? #wildfires #SemST,These ominous yellow Vancouver skies are making me dread our climate future.,I'm not saying it is the case - it's just one of the conditions we've seen during recent heatwaves and droughts. You get a lot of light and a lot of darkness. We'll find our way.,,It's understandable to feel dread when you see the effects of climate change in your own backyard,,"Yellow is my favorite color, so I can see why you would feel that way.",OTHER,"As an AI language model, I do not have personal emotions, but I understand that the yellow skies in Vancouver and other parts of the world due to wildfire smoke and air pollution can be alarming, especially when considering the long-term effects of climate change on our planet. It highlights the urgent need for us to take action to reduce greenhouse gas emissions and work towards a cleaner and sustainable future.",AGREE,"These ominous yellow Vancouver skies are making me dread our climate future.
 This year, the Earth Day Canada organization released a report, “The Climate Emergency: 5 Things You Should Know,” that should make any parent or caregiver very concerned about the safety of their children and grandchildren.
 We will need to figure out how to sustainably feed 10 billion people by 2050 and the only way to do this is to change the way we eat.
 As stated in the report, we’re currently on a trajectory to a 4-5 degree Celsius rise in global temperatures which will have catastrophic consequences",
