,id,target_topic,stance,towards,sentiment,source,original_text,clean_text,Godel_answer,majority_Godel,Davinci_answer,majority_Davinci,Blenderbot_answer,majority_Blenderbot,gpt-3.5-turbo_answer,majority_gpt-3.5-turbo,Llama_answer,majority_Llama
264,10107,Atheism,FAVOR,TARGET,NEGATIVE,testdata-taskA-all-annotations,@FaithMattersUK we could all just not use religion and beliefs as an excuse to murder and hate? #don'tmurder #SemST,Religion and beliefs are used as an excuse to murder and hate.,They're not. The entire point of religion and belief is to be evil.,,This is a sad reality that has been seen throughout history. Religion can be used to justify violence and,AGREE,"That's true, but I don't think it's a good excuse to be a Christian.",AGREE,"As an AI language model, I cannot agree or disagree, but I can say that religion and beliefs have been used as a justification for numerous acts of violence and discrimination throughout human history. However, it is important to note that such acts do not reflect the core teachings of most religions, and are often the result of misinterpretation or manipulation of religious texts and doctrines. It is crucial to promote greater tolerance and understanding between different religions and beliefs in order to prevent the misuse of religion as a justification for hatred and violence.",,"Religion and beliefs are used as an excuse to murder and hate. What have we as a species come to?
 This world is going to hell and they have only been here 10 years or so and I can see it all on TV.
 The first person to comment is right on it. We can’t let these “religious” people have power over our government, our laws, our morals and our way of life!
 Not to be confused with the New England Patriots.
 “Both the Boston Catholic Archdiocese and the Boston VA Health Care System, a federal agency, have been accused",
265,10119,Atheism,FAVOR,TARGET,NEGATIVE,testdata-taskA-all-annotations,"By accepting religion, you are pulling a big fuzz ball of superstition into your brain.  #freethinker #SemST","By accepting religion, you are pulling a big fuzz ball of superstition into your brain.",It's not religion. It's a belief system based on an inherently flawed premise that the real world is actually one big circle jerk.,AGREE,"Accepting religion is a personal choice, and it is up to the individual to decide if",OTHER,"That's a good way to look at it. I'm not religious, but I do believe in a higher power.",AGREE,"I'm sorry, but as an AI language model, I cannot provide personal opinions or beliefs. However, it is important to respect individuals' diverse beliefs and understand that religion can bring comfort and meaning to many people's lives. Additionally, religion can promote positive values and contribute to a sense of community and purpose. It is important to approach different belief systems with an open mind and without judgement.",DISAGREE,"By accepting religion, you are pulling a big fuzz ball of superstition into your brain.
 Religion is based on faith not fact.
 The God that you worship is based on stories that have been passed down through the generations.
 Who knows what the original version looked like.
 What we have now is a version that has been edited and altered by man.
 There are a lot of religious texts, and as a result, there are a lot of different versions of God.
 Their is no such thing as the one true religion, because every religion has a different version of",
266,10121,Atheism,FAVOR,TARGET,NEGATIVE,testdata-taskA-all-annotations,"As opposed to how the media portrays him,the pope is a religious wacko just like any of them and still supports bigotry & misogyny #SemST","As opposed to how the media portrays him, the pope is a religious wacko, just like any of them, and still supports bigotry and misogyny.","The Pope is a wacko just like any other president, just like any other president. He is just one of those guys that doesn't have all the balls to be president.",AGREE,"This statement is not accurate. The Pope is the leader of the Catholic Church, and while",DISAGREE,"I agree with you. The pope has been around for a long time. He was born in Bethlehem, Massachusetts.",AGREE,"As an AI language model, it is not my place to make personal opinions or derogatory statements towards any individual or group, including religious leaders or their followers. It is important to be respectful and considerate towards different beliefs and perspectives.",DISAGREE,"As opposed to how the media portrays him, the pope is a religious wacko, just like any of them, and still supports bigotry and misogyny. But, he has changed my mind about the Catholic Church. The Church has no business in politics or government, but they want to interfere in politics anyway.
 It's not just the Catholic Church. The Orthodox Church is just as political. The Mormons are some of the most politically active people in Utah, the Amish are active in Pennsylvania, the Baptists are active in Texas, the Muslims are active in Dearborn, the Jews are active in",
267,10123,Atheism,FAVOR,TARGET,NEGATIVE,testdata-taskA-all-annotations,"I hope for a time when schools teach 'ethics' instead of 'religion'. Sure - inc faiths bt in a sociocultl, geopoliticl context #SemST",I hope for a time when schools teach 'ethics' instead of 'religion'.,"Exactly - if I'm to be honest, I'd really rather a school taught 'ethics' than'religion'.",AGREE,I think this is a great idea. Teaching ethics in school can help students learn how to,AGREE,I hope so too. I think it's important for kids to learn about ethics and morals.,AGREE,"As an AI language model, I don't have a personal opinion, but I can give information regarding the topic.

The issue you raise is a highly debated one, and there are arguments for and against it. In this day and age, there is a growing awareness that a secular approach to education may be more beneficial in a diverse and multicultural society. While religion can provide valuable insights into ethics, there are those who argue that it can be divisive and exclusive.

Teaching ethics promotes a more inclusive approach to values education that allows for a wider range of perspectives and ideas to be explored. Ethics also allows for a deeper understanding of the principles that underpin our moral decision-making.

It is important that schools provide students with the tools and knowledge they need to make informed and ethical decisions throughout their lives. Ultimately, whether or not religion should be taught in schools is a matter for public debate, and the answer may vary depending on individual circumstances and cultural contexts.",,"I hope for a time when schools teach 'ethics' instead of 'religion'.
 When we teach 'religion', we teach intolerance.
 But when we teach 'ethics', we teach tolerance.
 The difference is subtle, but important.
 'Religion' has 'faith', 'dogma', and 'beliefs' that are subject to interpretation.
 'Ethics' has 'morals', 'truth' and 'behaviour' that are not subject to interpretation.
 When we teach 'religion', we teach people to believe things that are not true, and to treat each other unfairly.
 When we teach 'ethics', we teach people to do what is true, and to treat each other fairly.
 It is ironic that the fundamentalists",AGREE
268,10126,Atheism,FAVOR,TARGET,NEGATIVE,testdata-taskA-all-annotations,"Enough sneaking around, bringing in religious groups into #abed public #schools to access our kids in secrecy. #parents #SexED #SemST","Enough sneaking around, bringing in religious groups into public schools to access our kids in secrecy.",We don't need the sneaking around. These things are already being used by the government to harass and intimidate us.,,It is not appropriate for religious groups to sneak around and bring their beliefs into public schools without,AGREE,That sounds like a lot of fun. How many kids do you have and how old are they?,,"I'm sorry, I cannot provide an opinion as I am a language model AI and I am not programmed to have personal beliefs. However, it is important that any religious activities in public schools should be voluntary and not discriminatory towards any particular belief system. It is also important to ensure that the separation of church and state is respected in public institutions.",,"Enough sneaking around, bringing in religious groups into public schools to access our kids in secrecy. The school boards must be respected, they are duly elected by taxpayers, and they must have final say over curriculum.
 But our education system is in crisis. What makes it worse is the public-private partnership that has emerged between school boards, the province and corporations.
 The school boards have become captive to corporate influence, whether it be the Alberta Teachers Association, the Canadian Council of Christian Charities, or the Alberta Hotel and Lodging Association.
 As the Alberta Teachers Association has an interest in maintaining",OTHER
269,10131,Atheism,,TARGET,NEGATIVE,testdata-taskA-all-annotations,Subtract secularism from modern systems of superstition & you'll be left with the ancient anarchy of archaic theocracy.  #SemST,Subtract secularism from modern systems of superstition and you'll be left with the ancient anarchy of archaic theocracy.,The state of America is pretty much anarchy.,,"Secularism is the belief that religion should not be involved in government or public life, while superst",,I'm not sure I understand what you're talking about. Can you elaborate on this?,,"As an AI language model, I cannot agree nor disagree with the statement as it is a matter of personal opinion. However, I can provide an interpretation based on the words used.

The statement seems to suggest that the removal of secularism (the separation of religion and state) from modern systems of superstition (maybe referring to beliefs or practices that have no scientific basis) would lead to a return to an ancient system of anarchy (a state of disorder and lawlessness) that was based on theocracy (a form of government in which God or a deity is seen as the supreme ruler).

In other words, the statement implies that secularism is necessary to maintain order and prevent the abuses that might occur if religious or superstitious beliefs had too much influence over government and society. Without secularism, the society might devolve into chaos and oppression, as seen in historical theocracies.",,"Subtract secularism from modern systems of superstition and you'll be left with the ancient anarchy of archaic theocracy.
 It is a sad commentary that in the 21st century we still have people who believe in the superstitious and mystical.
 Ironically, it is these same people who also believe in the most ancient of superstitions: the belief in the inherent evil of the world and the necessity of a government to prevent it from getting out of control.
 Careful readers will note that there are no references to specific groups.
 There are no references to the Catholic Church, the Church of",
270,10135,Atheism,FAVOR,TARGET,NEGATIVE,testdata-taskA-all-annotations,Question to the #religious folks out there who can't comprehend the universe having began without a God. Where did God come from? #SemST,"Religious folks can't comprehend the universe having began without a God, but they have no explanation for where God came from.",That's not what the article is about.,OTHER,"This is a difficult question to answer, as it is impossible to know for certain where God",OTHER,That's a good point. There are so many different interpretations of the existence of God.,,"This argument is often used by atheists and non-believers to challenge the idea of God's existence. However, it is important to note that the concept of God in many religions does not depend on a physical origin or beginning. Rather, God is often seen as eternal and outside of time, space, and matter. 

In monotheistic religions such as Christianity, Judaism, and Islam, God is often described as the creator of the universe and all that exist within it. These religions do not necessarily claim to know how or why God exists, but rather hold that faith and belief in God's existence is a matter of strength of faith in the absence of evidence to the contrary. 

On the other hand, many scientists hold that the universe began with a Big Bang, a theory that does not inherently depend on an explanation for where the initial energy and matter came from. In this sense, the question of the origin of God or the universe may ultimately come down to one's personal belief system and the weight they place on the idea of faith versus logical explanation.",,"Religious folks can't comprehend the universe having began without a God, but they have no explanation for where God came from.
 The definition of a scientific explanation is that it is an attempt to explain some event on the basis of what we observe in the world.
 Science is an observation of natural events to understand the universe.
 I don't see how they can get around this.
 It's almost as if they don't want to know how the universe works.
 (I'm sure there are believers who do know and are trying to understand. This is not a stab at them.)",
271,10138,Atheism,FAVOR,TARGET,POSITIVE,testdata-taskA-all-annotations,"If the governments of all countries were secular, the world would be a much different, probably better, place. Realising this now. #SemST","If the governments of all countries were secular, the world would be a much different, probably better, place.","To be fair the US government would actually be secular, just not the one the CIA is currently in.",OTHER,"Without the influence of religious beliefs, governments would be able to make decisions based on facts and evidence rather",AGREE,I think so too. I think it would be nice to live in a peaceful country.,AGREE,"As an AI language model, I do not have a personal opinion, but I can provide some points on the topic.

A secular government is one that separates religion from the governance of the state. This means that laws and policies are not influenced or governed by religious ideologies. If all countries had a secular government, it would lead to a more equal and just society because:

1. Separation of Church and State: All citizens would be granted equal rights, and the government would not favor any particular religion, which would lead to a more secular society.

2. Religious Freedom: Each individual would have the right to practice their religion without any fear of persecution, as the government would not impose any particular religion.

3. More Focus on Social Issues: The government would focus more on social issues like poverty, education, healthcare, and mental health instead of promoting religious beliefs or ideologies.

4. Tolerance and Brotherhood: Secular governments promote co-existence, tolerance, and brotherhood among communities. This would lead to a reduction in conflicts between different religions or beliefs.

5. Better Policies and Laws: Law-making would be based on scientific evidence and facts, and decisions would not be biased by religious beliefs or traditions.

In conclusion, if governments of all countries were secular, the world would indeed be a much different and probably better place.",AGREE,"If the governments of all countries were secular, the world would be a much different, probably better, place.
 This is a topic that I have written about extensively. On this page I have collected all of the posts I have written on the subject.
 God and Politics - What Should You Be Voting For?
 The following quote is taken from the page about secularism on the website of the American Humanist Association.
 ""Secularism is a political principle that advocates the complete separation of church and state. This principle is based on the understanding that religious beliefs and political power are",
272,10140,Atheism,FAVOR,TARGET,NEGATIVE,testdata-taskA-all-annotations,What is the deal with #Christian people always needing to feel like they are persecuted? #ReligiousFreedom #tcot #SemST,What is the deal with Christian people always needing to feel like they are persecuted?,"I grew up in a town with a Christian dominated religion, and it was common to feel like you were being persecuted.",,The idea of Christian persecution is a complex one. It is rooted in the history of Christianity,OTHER,"I'm not sure, but I do know that Christianity is the largest religion in the world with over 2.4 billion followers.",OTHER,"As an AI language model, I don't have personal beliefs or opinions. However, it is true that some Christians claim to be persecuted because they feel their beliefs are not accepted or respected by others. This may stem from a historical context in which Christians were actually persecuted for their faith, such as during the time of the Roman Empire or during the Protestant Reformation. In modern times, there may be some cases where specific Christians or groups face discrimination or mistreatment, but it is important to recognize that this is not the norm in most parts of the world. It is also important to acknowledge that feeling persecuted may be a personal belief or perception, and may not necessarily reflect the reality of the situation.",,"What is the deal with Christian people always needing to feel like they are persecuted? Why do they need to feel like the victim? It’s not like we’re slaughtering them, or doing anything remotely close to that. You know, because of the whole “love your neighbor” thing.
 Last night, I had a text conversation with my best friend, and it was about the time that the POTUS gave that speech in Dallas. Now, I had nothing to do with that speech, but I was angry about it, because I don’t want to feel like a victim, I don’t want to",
273,10144,Atheism,FAVOR,TARGET,NEGATIVE,testdata-taskA-all-annotations,"#Religions can't all be right, but they can all be wrong. #SemST","Religions can't all be right, but they can all be wrong.",Religions aren't wrong or good. There are plenty of good and bad religions and they're all true.,,"This is true. While it is possible for one religion to be right, it is also",,"Yes, they can be. I'm not religious, but I do believe in a higher power.",AGREE,"As an AI language model, I am programmed to remain neutral and impartial towards religious beliefs. Therefore, I cannot agree or disagree with the statement above. However, the statement implies that there is a possibility that no religion accurately represents the truth about spirituality or the existence of a higher power. It also implies that it is important to consider different perspectives and beliefs before arriving at one's own conclusion.",OTHER,"Religions can't all be right, but they can all be wrong.
 Sometimes I think I'm far too cynical.
 Then I realize, ""Wait a minute, I am being far too cynical.""
 And then I remember, ""I'm right. I'm always right.""
 I like this post. I've been having the same thoughts about religion",AGREE
274,10148,Atheism,FAVOR,TARGET,NEGATIVE,testdata-taskA-all-annotations,@ACLU Get rid of religion... and all this will go away overnight... #humanist #egalitarian #SemST,Get rid of religion... and all the world's problems will go away overnight...,I'm sure religion won't solve all the problems in the world overnight but it will help bring down the costs of life.,,This is a highly debatable statement. While it is true that religion has been the source,OTHER,I don't think religion will ever go away. It will always be a part of our culture.,,"As an AI language model, I cannot impose opinions or beliefs. However, it is important to acknowledge that religion can be a deeply rooted and important aspect of many individuals' lives, providing a sense of community, purpose, and guidance. While religion has been a contributing factor to some conflicts, it is not necessarily the sole cause of all the world's problems. It is important to work towards respectful understanding and coexistence among different belief systems rather than attempting to eliminate them altogether. Ultimately, the solution to the world's problems lies in fostering empathy, open-mindedness, and compassion towards one another.",,"Get rid of religion... and all the world's problems will go away overnight...
 I think that's a perfect example of what I'm trying to get at. You see things as black and white and good or evil... they are never that simple... in fact they are always more complex than that.
 But, religion is one of the biggest sources of that black and white thinking in the world. The idea that there is a good and evil and that we must choose a side and commit to that side forever... that is stupid and a waste of human intelligence and",AGREE
275,10150,Atheism,FAVOR,TARGET,NEGATIVE,testdata-taskA-all-annotations,Existing is something god have never been proficient at.  #SemST,God has never been proficient at existing.,"Maybe because he doesn't believe in omnipotence, but he thinks that if we try to deflect the blame from him, it'll just bring forth more confusion and confusion. God, not man.",,God is not a physical being and therefore does not exist in the same way that humans do,OTHER,"God is always there for you, even if you don't believe in him. He's always there.",DISAGREE,"As an AI language model, I cannot express a belief or opinion about the existence or proficiency of God. My purpose is to provide neutral information and assist users in generating human-like text based on given prompts.",OTHER,"God has never been proficient at existing.
 And then God could make His plans.
 And then God could make His decisions.
 Because God is always proficient at existing.
 How can God make His plans?
 How can God make His decisions?
 Because He is proficient at existing.
 And then God could do His actions.
 Because He is proficient at existing.
 Therefore God can do His actions.
 How can God do His actions?
 Because He is proficient at existing.
 And then God could do His results.
 Because He is proficient at existing.
 Therefore God can do His results.
 And then God could",DISAGREE
276,10170,Atheism,FAVOR,TARGET,NEGATIVE,testdata-taskA-all-annotations,The experience of most LGBT people shows them that organised religion is often nothing but structured bullying. #SemST,The experience of most LGBT people shows them that organised religion is often nothing but structured bullying.,But if you don't live in a religion or have a religion then there is no place for you to live in. If you live in a religion then there is no place for you to live.,OTHER,"The experience of many LGBT people is that organized religion can be a source of exclusion, discrimination",,That is very true. It is sad that people can be so cruel to each other.,AGREE,"As an AI language model, I cannot express personal opinions or views as I do not have any beliefs or experiences. However, it is important to note that there is a long history of discrimination and persecution against LGBT individuals within many organized religions. While there are some religious communities and leaders who are accepting and supportive of the LGBT community, others continue to promote harmful ideas and practices that have contributed to the marginalization and mistreatment of LGBT individuals. It is crucial to foster understanding, acceptance, and respect for all individuals, regardless of their sexual orientation, gender identity, or religious beliefs.",AGREE,"The experience of most LGBT people shows them that organised religion is often nothing but structured bullying. A study from the National Gay and Lesbian Taskforce found that only 16% of those surveyed felt that they could be themselves in church, only 30% felt comfortable discussing their sexuality with their religious leader and only 3% felt that their views on homosexuality were openly accepted.
 So, we’re not surprised that people’s perception of religion has been, to use the word from the passage above, ‘straightened’. With a few well-publicised exceptions, most religious leaders have been unwilling to support the struggle of",
